<?xml version="1.0" encoding="UTF-8"?>
<bankCards xmlns:xsi="http://www.w3.org/2001/XMLSchema-instance"
  xsi:noNamespaceSchemaLocation="xsd/bankCard.xsd">
  <bankCard>
    <bankCardId>1</bankCardId>
    <cardNumber>4567 4567 3234 2342</cardNumber>
    <dateEnd>2023-12-31</dateEnd>
    <cvv>123</cvv>
    <nameOnCard>John Doe</nameOnCard>
    <clientId>1</clientId>
  </bankCard>
  <bankCard>
    <bankCardId>2</bankCardId>
    <cardNumber>4537 4567 3234 2342</cardNumber>
    <dateEnd>2023-12-30</dateEnd>
    <cvv>233</cvv>
    <nameOnCard>John Jones</nameOnCard>
    <clientId>1</clientId>
  </bankCard>
</bankCards>
